<?xml version="1.0" encoding="UTF-8"?>
<!--Sample XML file generated by XMLSpy v2010 (http://www.altova.com)-->
<tns:specifyingPublication xsi:schemaLocation="http://www.example.org/request/ request.xsd" xmlns:tns="http://www.example.org/request/" xmlns:xsi="http://www.w3.org/2001/XMLSchema-instance">
	<atribute>BIBTEX</atribute>
	<publications>
		<title>String</title>
		<author>String</author>
		<author>String</author>
		<author>String</author>
		<year>0</year>
		<journal>String</journal>
		<summary>String</summary>
		<pdfLink>String</pdfLink>
		<bibtex>String</bibtex>
		<subjectArea>String</subjectArea>
		<pagesCount>String</pagesCount>
		<keyword>String</keyword>
		<keyword>String</keyword>
		<keyword>String</keyword>
	</publications>
	<publications>
		<title>String</title>
		<author>String</author>
		<author>String</author>
		<author>String</author>
		<year>0</year>
		<journal>String</journal>
		<summary>String</summary>
		<pdfLink>String</pdfLink>
		<bibtex>String</bibtex>
		<subjectArea>String</subjectArea>
		<pagesCount>String</pagesCount>
		<keyword>String</keyword>
		<keyword>String</keyword>
		<keyword>String</keyword>
	</publications>
	<publications>
		<title>String</title>
		<author>String</author>
		<author>String</author>
		<author>String</author>
		<year>0</year>
		<journal>String</journal>
		<summary>String</summary>
		<pdfLink>String</pdfLink>
		<bibtex>String</bibtex>
		<subjectArea>String</subjectArea>
		<pagesCount>String</pagesCount>
		<keyword>String</keyword>
		<keyword>String</keyword>
		<keyword>String</keyword>
	</publications>
</tns:specifyingPublication>
